index,url,valid,domain,title,description,image,published,archive,content,quote,language,keyword
https://www.stern.de/gesellschaft/regional/hamburg-schleswig-holstein/steigender-meeresspiegel--sand-und-deiche-sichern-haeuser-auf-sylt-vor-sturmflut-folgen-36095772.html,https://www.stern.de/gesellschaft/regional/hamburg-schleswig-holstein/steigender-meeresspiegel--sand-und-deiche-sichern-haeuser-auf-sylt-vor-sturmflut-folgen-36095772.html,0,www.stern.de,Steigender Meeresspiegel: Sand und Deiche sichern Häuser auf Sylt vor Sturmflut-Folgen,Küstenschutzmaßnahmen bewahren auf Sylt Häuser und Menschen vor Sturmfluten und deren Folgen. Besonders bei steigendem Meeresspiegel hängt die Zukunft der Insel am Küstenschutz.,https://image.stern.de/36095774/t/OK/v1/w1440/r1.7778/-/01--yx6zi5wikfv7axs2048jpeg---271d01f5799660c1.jpg,2025-10-01T03:00:13Z,,"Kopiere den aktuellen Link
Zur Merkliste hinzufügen
Küstenschutzmaßnahmen bewahren auf Sylt Häuser und Menschen vor Sturmfluten und deren Folgen. Besonders bei steigendem Meeresspiegel hängt die Zu… [+4392 chars]",,de,'Sturmflut Sand'
https://www.welt.de/regionales/hamburg/article68dcc1b645848d2c8e7962d2/sylt-die-wachsende-sorge-vor-der-naechsten-sturmflut.html,https://www.welt.de/regionales/hamburg/article68dcc1b645848d2c8e7962d2/sylt-die-wachsende-sorge-vor-der-naechsten-sturmflut.html,0,www.welt.de,Die wachsende Sorge vor der nächsten Sturmflut,Küstenschutzmaßnahmen bewahren auf Sylt Häuser und Menschen seit jeher vor Sturmfluten und deren Folgen. Besonders bei steigendem Meeresspiegel hängt die Zukunft einiger Ortschaften nun aber am richtigen Küstenschutz.,https://images.welt.de/68dcc1b645848d2c8e7962d2/4876b2c42145c629bde10b3e1a650c48-master/ci16x9-w1200/sylt,2025-10-01T06:03:18Z,,"Wind und Wellen nagen an den Küsten von Sylt und tragen jährlich Teile der Insel ab. Um diesen Abbruch auszugleichen, werden an der Westküste seit mehr als 50 Jahren mit großen Rohren regelmäßig viel… [+3871 chars]",,de,'Sturmflut'
https://www.zeit.de/news/2025-10/02/leichte-sturmflut-droht-ausfaelle-bei-inselfaehren-moeglich,https://www.zeit.de/news/2025-10/02/leichte-sturmflut-droht-ausfaelle-bei-inselfaehren-moeglich,0,www.zeit.de,Hochwasser erwartet: Leichte Sturmflut droht – Ausfälle bei Inselfähren möglich,Hier finden Sie Informationen zu dem Thema „Hochwasser erwartet“. Lesen Sie jetzt „Leichte Sturmflut droht – Ausfälle bei Inselfähren möglich“.,https://img.zeit.de/news/2025-10/02/leichte-sturmflut-droht-ausfaelle-bei-inselfaehren-moeglich-image-group/wide__1300x731,2025-10-02T10:22:10Z,,Wegen eines erwarteten Herbststurmes und höherer Wasserstände an der Küste müssen sich Urlauber und Insulaner an diesem Wochenende auf mögliche Einschränkungen im Fährverkehr einstellen. Die Insel La… [+1997 chars],,de,'Sturmflut'
https://www.stern.de/gesellschaft/regional/niedersachsen-bremen/hochwasser-erwartet--leichte-sturmflut-droht---ausfaelle-bei-inselfaehren-moeglich-36100660.html,https://www.stern.de/gesellschaft/regional/niedersachsen-bremen/hochwasser-erwartet--leichte-sturmflut-droht---ausfaelle-bei-inselfaehren-moeglich-36100660.html,0,www.stern.de,Hochwasser erwartet: Leichte Sturmflut droht – Ausfälle bei Inselfähren möglich,Ausgerechnet am langen Feiertagswochenende wird an der niedersächsischen Küste ein Herbststurm erwartet. Das könnte Folgen für den Fährverkehr haben – worauf Ausflügler sich nun einstellen sollten.,https://image.stern.de/36100662/t/YZ/v1/w1440/r1.7778/-/02--jyberii4knv8axs2048jpeg---a70c8715b2b6f5b8.jpg,2025-10-02T10:22:10Z,,"Kopiere den aktuellen Link
Zur Merkliste hinzufügen
Ausgerechnet am langen Feiertagswochenende wird an der niedersächsischen Küste ein Herbststurm erwartet. Das könnte Folgen für den Fährverkehr ha… [+2208 chars]",,de,'Sturmflut Hochwasser'
https://www.zeit.de/news/2025-10/03/schwere-sturmflut-und-sturmboeen-an-der-nordseekueste-erwartet,https://www.zeit.de/news/2025-10/03/schwere-sturmflut-und-sturmboeen-an-der-nordseekueste-erwartet,0,www.zeit.de,Wetter: Schwere Sturmflut und Sturmböen an der Nordseeküste erwartet,Hier finden Sie Informationen zu dem Thema „Wetter“. Lesen Sie jetzt „Schwere Sturmflut und Sturmböen an der Nordseeküste erwartet“.,https://img.zeit.de/news/2025-10/03/schwere-sturmflut-und-sturmboeen-an-der-nordseekueste-erwartet-image-group/wide__1300x731,2025-10-03T13:27:07Z,,Stürmisches Wetter und eine Sturmflut sorgen in Niedersachsen und Bremen für ein ungemütliches Wochenende. An der Küste müssen Urlauber und Bewohner sogar mit möglichen Einschränkungen im Fährverkehr… [+1424 chars],,de,'Sturmflut Sturmböen'
https://www.stern.de/gesellschaft/regional/niedersachsen-bremen/wetter--schwere-sturmflut-und-sturmboeen-an-der-nordseekueste-erwartet-36103750.html,https://www.stern.de/gesellschaft/regional/niedersachsen-bremen/wetter--schwere-sturmflut-und-sturmboeen-an-der-nordseekueste-erwartet-36103750.html,0,www.stern.de,Wetter: Schwere Sturmflut und Sturmböen an der Nordseeküste erwartet,Das in den letzten Tagen ruhige Herbstwetter wird am Wochenende durch Sturmböen durcheinandergewirbelt. Das hat auch Auswirkungen auf den Fährverkehr zu den Inseln.,https://image.stern.de/36103752/t/EP/v1/w1440/r1.7778/-/03--afeox7hz7vv8axs2048jpeg---146c17a1fa1c38e5.jpg,2025-10-03T13:27:07Z,,"Kopiere den aktuellen Link
Zur Merkliste hinzufügen
Das in den letzten Tagen ruhige Herbstwetter wird am Wochenende durch Sturmböen durcheinandergewirbelt. Das hat auch Auswirkungen auf den Fährver… [+1604 chars]",,de,'Sturmflut Sturmböen'
https://www.welt.de/vermischtes/article68dfd7e935088eeb70a2a002/unwetter-schwere-sturmflut-und-sturmboeen-an-der-nordseekueste-erwartet.html,https://www.welt.de/vermischtes/article68dfd7e935088eeb70a2a002/unwetter-schwere-sturmflut-und-sturmboeen-an-der-nordseekueste-erwartet.html,0,www.welt.de,Schwere Sturmflut und Sturmböen an der Nordseeküste erwartet,Das in den vergangenen Tagen ruhige Herbstwetter wird am Wochenende in Niedersachsen und Bremen durch Sturmböen durcheinandergewirbelt. Das hat auch Auswirkungen auf den Fährverkehr zu den Inseln.,https://images.welt.de/68dfd7e935088eeb70a2a002/ee61c9659bfa2a5b3e1957cf54b6110f-master/ci16x9-w1200/norderney,2025-10-03T14:33:04Z,,Stürmisches Wetter und eine Sturmflut sorgen in Niedersachsen und Bremen für ein ungemütliches Wochenende. An der Küste müssen Urlauber und Bewohner sogar mit möglichen Einschränkungen im Fährverkehr… [+1384 chars],,de,'Sturmflut Nordsee'
https://www.n-tv.de/panorama/Orkantief-fegt-mit-bis-zu-110-km-h-ueber-Norddeutschland-article26073719.html,https://www.n-tv.de/panorama/Orkantief-fegt-mit-bis-zu-110-km-h-ueber-Norddeutschland-article26073719.html,0,www.n-tv.de,Sturmflut und Hagel: Orkantief fegt mit bis zu 110 km/h über Norddeutschland,"Sturm, Regen, Hagel: Wer an Nord- und Ostsee lebt, muss sich auf einen stürmischen Tag einstellen. Wo es besonders windig wird.",https://www.n-tv.de/img/incoming/crop26073722/3381329511-cImg_16_9-w1200/dbb1793703590da29efd02cc81e5ed6e.jpg,2025-10-04T04:38:23Z,,"Sturm, Regen, Hagel: Wer an Nord- und Ostsee lebt, muss sich auf einen stürmischen Tag einstellen. Wo es besonders windig wird. 
Orkanartige Böen mit teils bis zu 110 Kilometer pro Stunde ziehen übe… [+2034 chars]",,de,'Sturmflut Sturmböen'
https://www.tagesspiegel.de/gesellschaft/panorama/boen-von-bis-zu-100-kilometern-pro-stunde-sturmtief-fegt-uber-deutschland--verletzte-und-fahrausfalle-14466269.html,https://www.tagesspiegel.de/gesellschaft/panorama/boen-von-bis-zu-100-kilometern-pro-stunde-sturmtief-fegt-uber-deutschland--verletzte-und-fahrausfalle-14466269.html,0,www.tagesspiegel.de,Böen von bis zu 100 Kilometern pro Stunde: Sturmtief fegt über Deutschland – Verletzte und Fährausfälle,Eine Sturmflut hat die Küste erreicht. Doch nicht nur dort war es bislang ein stürmischer Tag. Zu Buche stehen bereits mehrere Verletzte und einige Sachschäden.,https://www.tagesspiegel.de/images/14475698/alternates/BASE_16_9_W1400/1759672130000/sturmboen-auf-der-insel-norderney.jpeg,2025-10-04T07:22:56Z,,Ein Sturmtief ist über Deutschland hinweggefegt und hat in mehreren Bundesländern Schäden angerichtet. Mindestens zwei Menschen wurden verletzt. An der Nordseeküste gab es am Sonntag eine Sturmflut; … [+4112 chars],,de,'Sturmflut Sturmtief'
