index,url,valid,domain,title,description,image,published,archive,content,quote,language,keyword
https://www.zeit.de/news/2025-04/11/portal-soll-buerger-besser-auf-naturgefahren-vorbereiten,https://www.zeit.de/news/2025-04/11/portal-soll-buerger-besser-auf-naturgefahren-vorbereiten,0,www.zeit.de,Hochwasser und Sturmflut: Portal soll Bürger besser auf Naturgefahren vorbereiten,Hier finden Sie Informationen zu dem Thema „Hochwasser und Sturmflut“. Lesen Sie jetzt „Portal soll Bürger besser auf Naturgefahren vorbereiten“.,https://img.zeit.de/news/2025-04/11/portal-soll-buerger-besser-auf-naturgefahren-vorbereiten-image-group/wide__1300x731,2025-04-11T10:16:57Z,,Mit einem neuen Internetportal sollen sich Menschen in Deutschland künftig besser über extreme Naturereignisse informieren und darauf vorbereiten können. «Mit dem Naturgefahrenportal lässt sich präzi… [+2278 chars],,de,'Sturmflut Hochwasser'
https://www.stern.de/panorama/hochwasser-und-sturmflut--portal-soll-buerger-besser-auf-naturgefahren-vorbereiten-35633080.html,https://www.stern.de/panorama/hochwasser-und-sturmflut--portal-soll-buerger-besser-auf-naturgefahren-vorbereiten-35633080.html,0,www.stern.de,Hochwasser und Sturmflut: Portal soll Bürger besser auf Naturgefahren vorbereiten,"Hochwasser, Sturmflut oder Starkregen: Menschen in betroffenen Gebieten sollen sich künftig besser darüber informieren können. Dabei helfen soll ein Internetportal.",https://image.stern.de/35633082/t/gy/v1/w1440/r1.7778/-/11--rk2pvtdu7gv5axs2048jpeg---521d86a65b8eaa18.jpg,2025-04-11T10:16:57Z,,"Kopiere den aktuellen Link
Zur Merkliste hinzufügen
Hochwasser, Sturmflut oder Starkregen: Menschen in betroffenen Gebieten sollen sich künftig besser darüber informieren können. Dabei helfen soll … [+2459 chars]",,de,'Sturmflut Starkregen'
https://www.teltarif.de/naturgefahrenportal-warnung-wetter/news/98339.html,https://www.teltarif.de/naturgefahrenportal-warnung-wetter/news/98339.html,0,www.teltarif.de,"""Naturgefahren"": Neues Portal soll Bürger besser vorbereiten","Hochwasser, Sturmflut oder Starkregen: Menschen in betroffenen Gebieten sollen sich künftig besser darüber informieren können. Dabei helfen soll ein Internetportal.",https://www.teltarif.de/img/arch/2025/kw15/naturgefahrenportal-warnung-wetter-1og.jpg,2025-04-11T11:45:11Z,,"Mit einem neuen Inter­netportal sollen sich Menschen
in Deutsch­land künftig besser über extreme Natur­ereig­nisse
infor­mieren und darauf vorbe­reiten können. ""Mit dem
Natur­gefah­renportal lässt… [+2658 chars]",,de,'Sturmflut Hochwasser'
https://www.faz.net/aktuell/gesellschaft/deutscher-wetterdienst-portal-warnt-vor-naturgefahren-110414564.html,https://www.faz.net/aktuell/gesellschaft/deutscher-wetterdienst-portal-warnt-vor-naturgefahren-110414564.html,0,www.faz.net,Deutscher Wetterdienst warnt auf Internetportal vor Naturgefahren,"Hochwasser, Sturmflut, Regen – vor solchen Wetterereignissen warnt nun ein Internetportal des Deutschen Wetterdienstes. Bürger finden dort auch Hinweise, wie sie sich schützen können.",https://media1.faz.net/ppmedia/aktuell/gesellschaft/409262254/1.10414785/facebook_teaser/die-webseite-des.jpg,2025-04-11T13:00:03Z,,Der Deutsche Wetterdienst (DWD) hat am Freitag ein Naturgefahrenportal im Internet freigeschaltet. Damit können sich Bürgerinnen und Bürger jederzeit beispielsweise über Hochwasser oder Sturmflut an … [+2413 chars],,de,'Sturmflut Hochwasser'
https://www.welt.de/reise/article255937754/Hallig-Hooge-in-der-Nordsee-Wer-hier-Urlaub-macht-uebt-sich-in-Verzicht.html,https://www.welt.de/reise/article255937754/Hallig-Hooge-in-der-Nordsee-Wer-hier-Urlaub-macht-uebt-sich-in-Verzicht.html,0,www.welt.de,"„Wer hier Urlaub macht, übt sich in Verzicht“","Die Halligen der Nordsee sind bei Sturmfluten fast komplett überspült. Hooge ist einer dieser merkwürdigen Orte. Ein Gespräch mit Buchautor Jan Keith über den steigenden Meeresspiegel und die Frage, warum es in dieser Weltabgeschiedenheit nicht langweilig ist.",https://img.welt.de/img/reise/mobile255976378/9317933337-ci16x9-w1200/Hallig-Hooge.jpg,2025-04-20T05:14:14Z,,"Sie sind vom Meer umflossen, bei Sturmflut werden sie fast komplett überspült die Halligen der Nordsee. Hooge ist einer dieser merkwürdigen Orte. Ein Kenner verrät, was den besonderen Reiz ausmacht.H… [+11382 chars]",,de,'Sturmflut Nordsee'
